### ISSUE TITLE
No solution for client websocket desktop air app, please help!

### ISSUE THREAD

**Issue by JoseEstevesPt** [airsdk/Adobe-Runtime-Support#3274]
I'm using Adobe Animate 24.0.3 and Air SDK 50.2.4.4, creating a desktop app that connects do websockets (websockt or websocket IO) server, I've tried all the old libraries, help of chat GPT, help of Copilot,  nothing works.
Then I saw this post...How can I get AIR SDK 51? will I be able to solve my problem. Please help!

### Discussed in https://github.com/airsdk/Adobe-Runtime-Support/discussions/3081

<div type='discussions-op-text'>

<sup>Originally posted by **ajwfrost** February 23, 2024</sup>
Hi all. Finally, we are releasing a new major version of the AIR SDK - the major version update is because of a number of new ActionScript APIs and features that are being added, which means the SWF version code will also be going up to 51 (fourth byte of the SWF = 0x33).

This discussion thread is to provide information about the new features/APIs. Our intention is to create a new main comment for each of the features, and then we (or anyone) can reply on those comment threads, so that we keep each thread specifically about a particular feature. We can then use it to give examples, provide updates on the status (51.0 is released initially as a beta/pre-release, some features are not actually completed), and hopefully it still stay roughly organised.

For full ActionScript API details, check out the "What's New" page of https://airsdk.dev/reference/actionscript/3.0/
</div>

**Comment by ajwfrost** [comment]
You can download AIR SDK 51 by selecting the version from https://airsdk.harman.com/release_notes
(I just noticed we hadn't updated the 'default' SDK version from the downloads page..)

But if you wait 12 hours, we should have 51.0.1.2 available which fixes a number of issues and would be better to use..

thanks

**Comment by JoseEstevesPt** [comment]
thanks Andrew, meanwhile I discovered the air sdk manager and downloaded air sdk 51.0.1.1 but I'me still struggling and can't make the connection work. Where can I find a simple code example?

**Comment by ajwfrost** [comment]
Well it should be a fairly straightforward thing, but having just tried it here, we seem to have some issues with the client-side connection. It's one of those that worked when we tried it locally, but trying it again now and I've just noticed a couple of problems.

Sample code, if you're connecting from AIR to a websocket server elsewhere:
```
		private function testWebSocket() : void
		{
			// create a connection to the websocket echo server
			_ws = new WebSocket();
			_ws.addEventListener(Event.CONNECT, onConnected);
			_ws.addEventListener(WebSocketEvent.DATA, onData);
			_ws.addEventListener(IOErrorEvent.IO_ERROR, onError);
			trace("Connecting to web socket test echo server");
			_ws.connect("wss://echo.websocket.org/echo");
		}
	
		private function onConnected(e : Event) : void
		{
			// send a test message
			trace("Connected: sending a message");
			if (_ws) _ws.sendMessage(WebSocket.fmtTEXT, "This is a test message");
		}
		
		private function onData(e : WebSocketEvent) : void
		{
			trace("Received data from the message");
			var msg : String = e.stringData;
			trace(msg);
		}
		
		private function onError(e :IOErrorEvent) : void
		{
			trace("Error connecting to server: " + e.text);
		}
```

We've just been finding that sometimes, the secure socket connection doesn't work - which appears to be a garbage collection issue (we use an internal instance of a socket within the websocket implementation and the mechanism used to prevent this from being GCed seems to not be working?).

And also we've just noticed that the test server used above is sending responses with different capitalisations to the requests, which our earlier test server didn't do, and this has then exposed an issue in the code.

So .. it may well not connect properly... are you trying to connect to anything public that we can check against? or if you are able to find out what network packages (at least the http messages) are being sent/received, we can take a look at those to see where it's going wrong.

We'll get fixes out in the next release (well, 51.0.1.3, a few weeks away I'm afraid) to try to resolve these..

thanks

**Comment by ajwfrost** [comment]
Hi @JoseEstevesPt  - can I check what operating system you're using to build/test this? We could share an update to try out perhaps?

**Comment by JoseEstevesPt** [comment]
Thanks once more, here is the code I’m using (yours of course), I’m using as a test server "wss://gr8events.tech/test”,still <wss://gr8events.tech/test%E2%80%9D,still> can’t connect getting one warning and one error.

Warning:
Scene 1, Layer 'Layer_1', Frame 1, Line 28, Column 10	Warning: 1090: Migration issue: The onData event handler is not triggered automatically by Flash Player at run time in ActionScript 3.0.  You must first register this handler for the event using addEventListener ( 'data', callback_handler).

Error:
Connecting to web socket test echo server
Error connecting to server: Error #2031: Socket Error. URL: gr8events.tech <http://gr8events.tech/>

I’m running Animate on macOS Sonoma version 14.5




import flash.events.Event;
import flash.events.IOErrorEvent;
import flash.events.SecurityErrorEvent;
import flash.events.WebSocketEvent;
import air.net.WebSocket;
    
var _ws:WebSocket
_ws = new WebSocket();
_ws.addEventListener(Event.CONNECT, onConnected);
_ws.addEventListener(WebSocketEvent.DATA, onData);
_ws.addEventListener(IOErrorEvent.IO_ERROR, onError);
trace("Connecting to web socket test echo server");

//_ws.connect("wss://echo.websocket.org/echo");

ws.connect("wss://gr8events.tech/teste");

	
	
function onConnected(e : Event) : void
		{
			// send a test message
			trace("Connected: sending a message");
			if (_ws) _ws.sendMessage(WebSocket.fmtTEXT, "This is a test message");
		}
		
function onData(e : WebSocketEvent) : void
		{
			trace("Received data from the message");
			var msg : String = e.stringData;
			trace(msg);
		}
		
function onError(e :IOErrorEvent) : void
		{
			trace("Error connecting to server: " + e.text);
		}

**Comment by ajwfrost** [comment]
Thanks

So .. with the changes we've just made here, we can connect to the echo service and send/receive messages now. But with your server, when we connect via a WebSocket, we get:
```
[OPENSSL] 0xe13a968 SSL_connect: Handshake failed(1)!
```
But, when we connect directly using a SecureSocket, the handshaking works.

We'll have to investigate that a little more! Your server looks fine from what we can tell from an SSL check, we're trying to use TLS v1.3 for the connection.. and it shouldn't really be the case that a SecureSocket works from client code but not when it's run from within the builtin code!

Will check on this and if we can get past these issues, will send you an update build to test!

thanks

**Comment by JoseEstevesPt** [comment]
Thanks Andrew an update build sounds great!
To test if my server is ok, i'm using Postman and all works well with the connections.
Hope to ear from you soon :)

**Comment by ajwfrost** [comment]
Okay, the handshaking works when it's actually a connection on port 443. There's an omission in our detection code for the default port number so this had been trying to connect on port 80!

There is then the same issue that we had in the echo service with our code being too strict (i.e. not properly reading the specification..). The earlier issue I thought was related to garbage collection was actually just because we were debugging and there was a timeout happening behind the scenes!

So - will get a test build prepared for you for macOS..

thanks

**Comment by JoseEstevesPt** [comment]
Thanks once more, good news.

**Comment by ajwfrost** [comment]
Hi - please use the below link and then unzip that over the top of AIR 51 (it's built on top of 51.0.1.2 but shouldn't matter which 51.0.x.x version is under it...). This should
- ensure we have the correct port number used by default for secure websocket cases
- be more robust with the WebSocket protocol handshaking

https://transfer.harman.com/link/SYIfSjYLk7HDJbu6VuJ4u9

thanks

**Comment by JoseEstevesPt** [comment]
Andrew, thanks, you were really helpful. It seams to work now, later I will make more complex tests.

**Comment by raresn** [comment]
@JoseEstevesPt what are you using for the server? Thinking of implementing this in our app as well.

**Comment by JoseEstevesPt** [comment]
It's a linux web server, with node.js, express, ws, hope this was helpful.

**Comment by JoseEstevesPt** [comment]
Hello, some more issues...once more help needed.
Everything runs fine in testing / development, but when I publish it to air, just won't install on a windows machine (yes I'm developing in mac but the production machine will be in windows).  Tried to update AIR runtime  to version version 50.2.4.1, with no success.  I think the runtimes (51.0.1.1) you sent will only work on mac, correct? 
The project involves 2 apps (one air desktop windows and a second one running on android).
My second problem is that due to missing files I can't compilo to Android. Can you once more help? thank you in advance.

**Comment by ajwfrost** [comment]
For the first one -> we don't have an AIR shared runtime version 51.x yet. But will hopefully update that shortly!

For the second .. what's the SDK that you've got Animate pointed to? It seems strange for one of our SDKs to be missing that file, but strange for a non-Harman SDK to even be looking for it. So there may have been some issue with installation/deployment of the AIR SDK....?

If you have AIR SDK Manager open to the "Troubleshooting" tab, try building from Animate again, and see what the logs say..

**Comment by JoseEstevesPt** [comment]
Thanks for the fast reply.
For the first issue, please define shortly, 1,2 days...or more?

For the second issue, I was able so solve the issue, and compile the APK, but it will not connect to the websocket, on the android tablet in production.

**Comment by ajwfrost** [comment]
Yes, one or two days should be about right - we had a slight issue with the macOS version that needs to be re-packaged..

If you've got issues with the Android connection: is that from the tablet, or to it? If the Android tablet is the client side then it may be challenging to sniff what's happening on the network (unless you are running the server?) but that would be my suggestion, so we can see the HTTP traffic and work out where the disconnection is coming. It may be best to try things in stages e.g. does it work on HTTP, before moving to HTTPS, and could you try the Android emulator before trying it on device, etc?

But I can also ask someone to try your test server from an Android handset here and see what happens...

**Comment by JoseEstevesPt** [comment]
I tried with two android tablets and could not connect, both can go online, and connect to webservices and download data, but can't connect to websocket server.  I will wait for the nest macOS version, and test it again.

**Comment by JoseEstevesPt** [comment]
I think that will solve my problems... but now I have a time problem, next week i must have everything ready and working... will it happen?

**Comment by ajwfrost** [comment]
So the ideal scenario would probably be if we can find and fix the JIT thing in the next two days, then I'll trigger an update release to 51.0.1.3 with this stuff plus whatever other changes are in...

But to validate this websocket stuff, it would probably also be useful if I can send you an interim Android package that you can use to test it with! Otherwise we risk you finding a problem too last-minute to be able to change... I can kick that off fairly easily..

thanks

**Comment by JoseEstevesPt** [comment]
The interim Android package sounds just great, an I will be able to share any problems I encounter.

**Comment by JoseEstevesPt** [comment]
hello, thanks for the files, just tried it...with no success, still cant connect to websocket on android.
Works perfect on Mac, on Android on the debug I get  Error #2031: Socket Error. URL: gr8events.tech

**Comment by ajwfrost** [comment]
FYI we seem to have a more fundamental issue with secure sockets on the latest Android versions. With some hacks, I can get the echo server to work, but I'm having to manually pass in a bunch of root certificates, ignoring an error code, and ignoring a CRL read failure. Will see if we can make this work a little better, we may need to have some other client-side workaround to avoid opening up some security holes in the short term...

thanks

**Comment by JoseEstevesPt** [comment]
I'm running out of time, can I expect a solution in short term? (2,3 days), will it work in non secure websocket? how can I help?

**Comment by ajwfrost** [comment]
It should work fine if it's not over a secure protocol ... something is up with SSL here, it won't be a particularly quick fix I'm afraid...

**Comment by JoseEstevesPt** [comment]
I've just tried using "ws://gr8events.tech:4117/" with no success, can connect with postman, with no problem.
All works on mac, not on android...please help.

**Comment by ajwfrost** [comment]
Can you double-check that port, I'm not getting any response when trying to connect a socket to `176.61.146.17:4117`.. it retransmits after 1/2/4/8s and then gives up...

```
Transmission Control Protocol, Src Port: 54141, Dst Port: 4117, Seq: 0, Len: 0
    Source Port: 54141
    Destination Port: 4117
    [Stream index: 4]
    [Conversation completeness: Incomplete, SYN_SENT (1)]
    [TCP Segment Len: 0]
    Sequence Number: 0    (relative sequence number)
    Sequence Number (raw): 1763988296
    [Next Sequence Number: 1    (relative sequence number)]
    Acknowledgment Number: 0
    Acknowledgment number (raw): 0
    1000 .... = Header Length: 32 bytes (8)
    Flags: 0x002 (SYN)
    Window: 64240
    [Calculated window size: 64240]
    Checksum: 0x0422 [unverified]
    [Checksum Status: Unverified]
    Urgent Pointer: 0
    Options: (12 bytes), Maximum segment size, No-Operation (NOP), Window scale, No-Operation (NOP), No-Operation (NOP), SACK permitted
    [Timestamps]
```

**Comment by JoseEstevesPt** [comment]
I just tested again with postman and works "ws://gr8events.tech:4117", but testing with your code on my mac it only works if I use"ws://gr8events.tech:4117/", it need the extra slash. When I publish to android it will not work, will not conencto to the server.

**Comment by JoseEstevesPt** [comment]
GET / HTTP/1.1
Sec-WebSocket-Version: 13
Sec-WebSocket-Key: Eu7hFWF/6WXbxeA/mCzzQg==
Connection: Upgrade
Upgrade: websocket
Sec-WebSocket-Extensions: permessage-deflate; client_max_window_bits
Host: gr8events.tech:4117
 
HTTP/1.1 101 Switching Protocols
Upgrade: websocket
Connection: Upgrade
Sec-WebSocket-Accept: KRMUfQsZ8KbKInqQfpOCQLTTrzE=

**Comment by ajwfrost** [comment]
Okay so something may be happening within our network to block that location/port.. 
The "extra slash" thing is a limitation here which we can resolve.

But are you saying that even with the updated Android runtime files, you can't connect to the non-secure version on port 4117?

Is that HTTP log from Postman? I assume so, we don't send the extensions method... plus on the "Host" line, we wouldn't be sending the port number. Maybe we should add that..

I think the quickest thing here may be to do a separate mechanism for Android via ANE in the short term, whilst we work on what's going wrong with the SSL connection... let me check how quickly we may be able to get that done.

thanks

**Comment by JoseEstevesPt** [comment]
There was a firewall issue from outside of Portugal, but all good now.
And yes with the updated Android Ruttimes I can't coonect.
It was the postman log.
My time is running very short, need some kind of solution for this. Thanks for your help.

**Comment by ajwfrost** [comment]
Can I check your requirements here:
* Do you use the websocket "protocol" thing i.e. `Sec-WebSocket-Protocol` headers?
* Do you use both binary and string based messages, or just one type?

We can get you something for Monday or latest Tuesday, assuming you don't need the extra protocol handling. The questions just narrow down the scope for a "version 1" -> putting the Android capability into an ANE. Functionality-wise, it would be the same API (and derive from `air.net.WebSocket`) so it would just mean you need to change where your code creates the object initially, to use a different class name...

**Comment by JoseEstevesPt** [comment]
server side:
https://www.npmjs.com/package/ws

server code:
const WebSocket = require("ws");
const http = require("http");
const { v4: uuidv4 } = require("uuid");

// Create an HTTP server
const server = http.createServer((req, res) => {
  res.writeHead(200, { "Content-Type": "text/plain" });
  res.end("TESTE\n");
});

// Attach WebSocket server to the HTTP server
const wss = new WebSocket.Server({ server });

// Armazenar clientes conectados e seus IDs
const clients = new Map();

wss.on("connection", (ws) => {
  console.log("Client connected");

.....


// Start the server on port 4116
server.listen(4117,'0.0.0.0', () => {
  console.log("Server is listening on port 4117");
});

**Comment by ajwfrost** [comment]
Hi
Can you please use the attached ANE file (zipped up here) - if you do:
```
 var ws : WebSocket = new AndroidWebSocket();
```
it should work the same way as the normal WebSocket class, but using an ANE.

[AndroidWebSocketANE.zip](https://github.com/user-attachments/files/15765029/AndroidWebSocketANE.zip)

Note: this uses a third party library: https://github.com/TakahikoKawasaki/nv-websocket-client/
The ANE doesn't actually include this, but it will mean that your application includes it, so please check the license terms (if you have any 'notices' file or third-party software notices in your app, you will need to add this one to it).

This works with WSS connections, and with your test server there. You'll need the extension added to your app descriptor file:
```
        <extensionID>com.harman.AndroidWebSocket</extensionID>
```

**Comment by JoseEstevesPt** [comment]
thanks for all your effort, I will give it a try.

**Comment by JoseEstevesPt** [comment]
@ajwfrost It din't worked, could not make it work and connect to server, had problems with the ANE testing in android "/private/var/folders/gx/d19f6_y10n92n10dg1lb6gf40000gn/T/TemporaryItems/TesteControla Websocket ane_ANE_Cache/AndroidWebSocket.ane is not a valid native extension file.". But due to the deadline, had to change te project to work with sockets on a local network, with local server, not websockets.  Thanks for your effort, and hope that the websockets will be working on future releases, all across different platforms, it will be very useful. Once again thanks for you fast support.

**Comment by ajwfrost** [comment]
Shame - sounds like something went wrong with the ANE packaging/extraction from that log.. 
A better plan for us would be to have an implementation of "SecureSocket" on Android that actually works, after which the normal/native WebSocket class should be sufficient.

thanks

**Comment by bobaoapae** [comment]
@ajwfrost i'm having a problem on windows with websockets.

```
_webSocket = new WebSocket();
_webSocket.connect("wss://ws-emulador.redesurftank.com.br");
[trace] ERROR: UncaughtError: Error #2031: Socket Error. URL: ws-emulador.redesurftank.com.br
[trace] Error
[trace] 	at Loading/uncaughtErrorHandler()[D:\IdeaProjects\ddtank-client\loadingAir\src\Loading.as:178]
[trace] 	at flash.events::EventDispatcher/dispatchEventFunction()
[trace] 	at flash.events::EventDispatcher/dispatchEvent()
[trace] 	at air.net::WebSocket/forwardEvent()
```

**Comment by bobaoapae** [comment]
```
_webSocket = new WebSocket();
_webSocket.connect("wss://websocket.redesurftank.com.br:443/test");
_webSocket.addEventListener(SecurityErrorEvent.SECURITY_ERROR, function (param1:SecurityErrorEvent):void
        {
            dispatchEvent(new ErrorEvent("error", false, false, param1.text));
        });
 _webSocket.addEventListener(ErrorEvent.ERROR, function (param1:ErrorEvent):void
        {
            dispatchEvent(new ErrorEvent("error", false, false, param1.text));
        });
 _webSocket.addEventListener("ioError", function (param1:ErrorEvent):void
        {
            dispatchEvent(new ErrorEvent("error", false, false, param1.text));
        });
```
        
In this example I get `ioError`. This websocket works normally testing from any other software, this websocket it's being proxied by cloudflare workers, maybe some headers are diff from expected by harman but this should be valid, as this works normally from any browser or others websocket programs.

**Comment by ajwfrost** [comment]
I'm getting a 'connected' event when I try this code..?! What version of AIR SDK are you using?

**Comment by ajwfrost** [comment]
Okay .. odd. On Windows?
`wss://websocket.redesurftank.com.br:443/test` definitely works for me.

`wss://ws-emulador.redesurftank.com.br` gives me an ioError. Although it seems like I can access it in a browser..

Hmm... looking at the details, we're getting a response from your server `HTTP/1.1 400 Bad Request`
The request was:
```
GET / HTTP/1.1
Host: ws-emulador.redesurftank.com.br
Upgrade: websocket
Connection: Upgrade
Sec-WebSocket-Key: oPUwvunee9s0aNmnu3hNdQ==
Sec-WebSocket-Version: 13
```

Are you able to check the server logs?
I can't get it to connect via https://websocketman.com/ although that may be CORS related.

Actually, I see in the HTTP response, a "Missing token" body.. so I suspect there's a need for some kind of authentication token from the cloudflare server? Are you able to make any successful connection to it and check the HTTP headers/responses and see if something like that exists?

If so .. we may need to change things so that the connection request is provided a `URLRequest` object, so that you can add headers etc..

**Comment by bobaoapae** [comment]
ws-emulador old example, sorry. Testing just with websocket.redesurftank...

I fully unistalled airsdk, deleted cache from sdkmanager downloaded again and now it's work. I suspect that airsdk manager don't fully updated, due to the old tests coping files over e-mail to the sdk path.

**Comment by bobaoapae** [comment]
@ajwfrost hey, me again.

On windows i can use websocket without problems here now, but testing on android i get this error

`[IOErrorEvent type="ioError" bubbles=false cancelable=false eventPhase=2 text="Error #2031: Socket Error. URL: websocket.redesurftank.com.br" errorID=2031]`


code:
```
_webSocket.connect("wss://websocket.redesurftank.com.br/harman/1016");
```

**Comment by bobaoapae** [comment]
I'm trying to use the ANE extension to test, but i get this error on package:
`Failed to package AIR application loadingAirAndroidDebug.apk:  D:\IdeaProjects\ddtank-client\loadingAirAndroid\src\ane\AndroidWebSocket.ane is not a valid native extension file. `

**Comment by bobaoapae** [comment]
I'm trying to use the ANE, but I get this error on package:
`Failed to package AIR application loadingAirAndroidDebug.apk:  D:\IdeaProjects\ddtank-client\loadingAirAndroid\src\ane\AndroidWebSocket.ane is not a valid native extension file.`

**Comment by ajwfrost** [comment]
Hi

On Android, we seem to be facing an underlying problem with the secure sockets, so if you're using WSS then you may face that problem. The ANE gets around this by using a separate Java library (imported via gradle: `com.neovisionaries:nv-websocket-client:2.14`) which handles all the WebSocket stuff within the Java/Android layer.

I've just rebuilt the ANE and checked it, below is a zip of the ANE (i.e. please extract the file from within here). If you still get that 'is not a valid native extension file' please confirm what AIR SDK version you're using, and open up the ANE in a zip manager to check you see a top level set of files including catalog.xml, library.swf and mimetype.
[AndroidWebSocket_ane.zip](https://github.com/user-attachments/files/16024294/AndroidWebSocket_ane.zip)


thanks

**Comment by bobaoapae** [comment]
same error
`D:\IdeaProjects\ddtank-client\loadingAirAndroid\src\ane\AndroidWebSocket.ane is not a valid native extension file.`
Air version: 51.0.1.3

![image](https://github.com/airsdk/Adobe-Runtime-Support/assets/33332428/b2a91990-a8aa-41ba-bbba-f40d7fee82b9)

Image show air version and ane files open in winrar.

**Comment by bobaoapae** [comment]
manually editing catalog.xml and all plataform xml to use 50.2 instead of 51.0 fixed the error of invalid ane.

**Comment by bobaoapae** [comment]
[AndroidWebSocket.zip](https://github.com/user-attachments/files/16030613/AndroidWebSocket.zip)

**Comment by bobaoapae** [comment]
Connection to websocket works using this ANE, but my websocket server it's not receiving any data after i call `_webSocket.sendMessage(WebSocket.fmtBINARY, sendBytes);`

**Comment by bobaoapae** [comment]
```
06-28 11:08:26.967  3013  4505 D AndroidSocketThread: Callback: onSendingHandshake
06-28 11:08:27.510  3013  4505 D AndroidSocketThread: Callback: onStateChanged
06-28 11:08:27.511  3013  4505 D AndroidSocketThread: Callback: onThreadCreated
06-28 11:08:27.512  3013  4505 D AndroidSocketThread: Callback: onThreadCreated
06-28 11:08:27.512  3013  4505 D AndroidSocketThread: Callback: onThreadStopping
06-28 11:08:27.513  3013  4523 D AndroidSocketThread: Callback: onThreadStarted
06-28 11:08:27.513  3013  4523 D AndroidSocketThread: Callback: onConnected
06-28 11:08:27.513  3013  4524 D AndroidSocketThread: Callback: onThreadStarted
06-28 11:08:27.522  3013  3013 D AndroidWebSocketSendMessage: Called sendMessage
06-28 11:08:27.522  3013  3013 D AndroidWebSocketSendMessage: Message is a byte array
06-28 11:08:27.522  3013  3013 E AndroidSocketThread: Eror sending bytes: null
```

**Comment by ajwfrost** [comment]
> manually editing catalog.xml and all plataform xml to use 50.2 instead of 51.0 fixed the error of invalid ane.

`WebSocket` is a class introduced in AIR 51.0 so I'm a little surprised it works if you drop that down.

Although ... ah, I've just realised, we had a bug in how the platform descriptor files derived from earlier ones, which may have caused this. The fix is already in our internal builds, about to be released, so I wouldn't have seen that issue....

-----
> `E AndroidSocketThread: Eror sending bytes: null`

We'll have to check on this one.. are you able to confirm that you sent in a byte array (and presumably it wasn't null or empty)?

thanks

**Comment by bobaoapae** [comment]
> > manually editing catalog.xml and all plataform xml to use 50.2 instead of 51.0 fixed the error of invalid ane.
> 
> `WebSocket` is a class introduced in AIR 51.0 so I'm a little surprised it works if you drop that down.
> 
> Although ... ah, I've just realised, we had a bug in how the platform descriptor files derived from earlier ones, which may have caused this. The fix is already in our internal builds, about to be released, so I wouldn't have seen that issue....
> 
> > `E AndroidSocketThread: Eror sending bytes: null`
> 
> We'll have to check on this one.. are you able to confirm that you sent in a byte array (and presumably it wasn't null or empty)?
> 
> thanks

Yeah.. sending byteArray.

```
private function sendConfirmConnection():void
    {
        var sendBytes:ByteArray =new ByteArray();
        sendBytes.writeUTF(RandomUtils.UIDv4());
        sendBytes.writeUTF("confirm-connection");
        sendBytes.writeInt(_areaId);
        sendBytes.writeUTF("token");
        sendBytes.writeBoolean(_wsConnectionId != null);
        if (_wsConnectionId != null)
        {
            sendBytes.writeUTF(_wsConnectionId);
        }
        _webSocket.sendMessage(WebSocket.fmtBINARY, sendBytes);
    }
````

**Comment by bobaoapae** [comment]
My implementation it's working normally for windows, i just made a change to use AndroidWebSocket instead of WebSocket..

**Comment by ajwfrost** [comment]
Hi

You can try this one, it fixes an issue with sending and receieving ByteArray data..

[AndroidWebSocket_ane_v3.zip](https://github.com/user-attachments/files/16043612/AndroidWebSocket_ane_v3.zip)

thanks

**Comment by Mintonist** [comment]
What is a result?)
Can we use WebSocket across all platforms (Android, IOS, Windows) with the same code?
Can we implement full SocketIO client using it?

**Comment by bobaoapae** [comment]
Yes, and if you have any issues using the provided solution by AIR you can try my ANE.

https://github.com/bobaoapae/ane-awesome-utils

**Comment by ajwfrost** [comment]
The AS3 WebSocket should work cross-platform, the only current issue is that on Android, WSS (secure websockets) is not working. We have an alternative secure-socket mechanism that will come in to 51.2 in the new year, that will fix that issue..

thanks

**Comment by Shaunmax** [comment]
> on Android, WSS (secure websockets) is not working.

@ajwfrost : - Do you have any rough timeline for its release? We're using Colyseus for multiplayer, and since it relies on WSS, this issue is a bit of a blocker for us on Android.

In the meantime, could you please tell me how `AndroidWebSocket` ane can be used in a project and also, would it even work with Colyseus, or is it more of a general-purpose WebSocket solution?

Thanks!

**Comment by ajwfrost** [comment]
The underlying secure socket update on Android is in the 51.2 pre-release, with the `certificateError` functionality being added this week. I'm not sure we've actually checked that this then makes the secure websocket functionality work, but I would expect it to -> we'll double-check that! But then, as soon as we get maturity into the 51.2 branch, it will be available...

I wasn't aware of an issue with HTTPS connections though, they use a different mechanism. Unless you're using a proxy server as we know of an issue with that..? Do you get any error information out from the logcat (or AS3 error event info?) or the server perhaps?

thanks

**Comment by Shaunmax** [comment]
@ajwfrost or could this be an issue that's mentioned here 
https://github.com/airsdk/Adobe-Runtime-Support/issues/2620
i can also confirm that `"serverCertificateStatus":"invalid"`

**Comment by ajwfrost** [comment]
@Shaunmax went round in circles a bit looking at that Colyseus code, looking to see how it does HTTP - but then seems it uses a third party library ("tink")? Not quite sure how this would work as a cross-platform library seeing as normal sockets don't get exposed within a browser, but it's possible that different implementations are written for http within a browser vs within a SWF etc. Which doesn't really answer the key question = what AS3 AIR API is being used to access the content via http here ... if it's `Socket`, I'm not surprised; if it's `URLRequest` then we may have a new problem...!

**Comment by Shaunmax** [comment]
> if it's `Socket`, I'm not surprised;

yes : - https://github.com/colyseus/colyseus-websocket-hx/blob/master/src/haxe/net/impl/SocketFlash.hx

**Comment by endel** [comment]
Hi @ajwfrost 👋 I hope you're doing great!

I'm the author of Colyseus, I've been in chats with @Shaunmax trying to understand this issue... 

(The `tink` library is capable of doing HTTPS requests, it does have a specific [`FlashClient`](https://github.com/haxetink/tink_http/blob/master/src/tink/http/clients/FlashClient.hx) using `URLRequest`)

About Colyseus specifically, the error we get is [at this event handler](https://github.com/colyseus/colyseus-websocket-hx/blob/c277dfbac878c296b0dd8ffef4391a52d62788dc/src/haxe/net/impl/SocketFlash.hx#L33-L35), when establishing a WebSocket connection.

The WebSocket implementation we have is using `flash.net.SecureSocket`, and we're getting the following `flash.events.IOErrorEvent.IO_ERROR`:

```
SocketFlash.io_error
{"bubbles":false,"cancelable":false,"type":"ioError","errorID":2031,"text":"Error #2031: Socket Error. URL: us-sea-fb6aab57.colyseus.cloud","target":{"bytesAvailable":0,"objectEncoding":3,"endian":"bigEndian","connected":false,"bytesPending":0,"tcpNoDelay":false,"timeout":20000,"localAddress":"192.168.29.100","serverCertificateStatus":"invalid","localPort":37784,"remotePort":443,"remoteAddress":"66.42.76.171","serverCertificate":{"subjectPublicKeyAlgorithmOID":"OID.1.2.840.10045.2.1","signatureAlgorithmOID":"OID.1.2.840.10045.4.3.3","subjectPublicKey":"04b06531110fa16e1a6035520753a494cf37e5722e48abf734e35a4e6e3930525f152fdb782970ada631ab8b44d9e88cbf2e1334db442f49efda12883f270fdac1","version":2,"signatureAlgorithmParams":"ByteArray","issuerUniqueID":null,"issuer":{"countryName":"US","organizationalUnitName":null,"localityName":null,"commonName":"E6","stateOrProvinceName":null,"organizationName":"Let's Encrypt"},"subjectUniqueID":null,"validNotBefore":"Sat Feb 8 10:08:03 GMT+0530 2025","encoded":"ByteArray","validNotAfter":"Fri May 9 10:08:02 GMT+0530 2025","subject":{"countryName":null,"organizationalUnitName":null,"localityName":null,"commonName":"*.colyseus.cloud","stateOrProvinceName":null,"organizationName":null},"serialNumber":"03b27a1dd99109e6f5707b8bc57642b63f61"}},"currentTarget":{"bytesAvailable":0,"objectEncoding":3,"endian":"bigEndian","connected":false,"bytesPending":0,"tcpNoDelay":false,"timeout":20000,"localAddress":"192.168.29.100","serverCertificateStatus":"invalid","localPort":37784,"remotePort":443,"remoteAddress":"66.42.76.171","serverCertificate":{"subjectPublicKeyAlgorithmOID":"OID.1.2.840.10045.2.1","signatureAlgorithmOID":"OID.1.2.840.10045.4.3.3","subjectPublicKey":"04b06531110fa16e1a6035520753a494cf37e5722e48abf734e35a4e6e3930525f152fdb782970ada631ab8b44d9e88cbf2e1334db442f49efda12883f270fdac1","version":2,"signatureAlgorithmParams":"ByteArray","issuerUniqueID":null,"issuer":{"countryName":"US","organizationalUnitName":null,"localityName":null,"commonName":"E6","stateOrProvinceName":null,"organizationName":"Let's Encrypt"},"subjectUniqueID":null,"validNotBefore":"Sat Feb 8 10:08:03 GMT+0530 2025","encoded":"ByteArray","validNotAfter":"Fri May 9 10:08:02 GMT+0530 2025","subject":{"countryName":null,"organizationalUnitName":null,"localityName":null,"commonName":"*.colyseus.cloud","stateOrProvinceName":null,"organizationName":null},"serialNumber":"03b27a1dd99109e6f5707b8bc57642b63f61"}},"eventPhase":2}
```

(I don't think we've tried using `air.net.WebSocket` yet, but I'm not sure it would have a different result considering the experience of other users on this thread...)

We've tried a few things recently, and unfortunately none of them seemed to help:
- We included the Root Certificate as part of the TLS certificate chain in the server-side (Let's Encrypt by default only includes 2 intermediary certificates, and not the Root certificate by default)
- Tried using both `Security.loadPolicyFile("http://us-sea-fb6aab57.colyseus.cloud/crossdomain.xml")` and `Security.loadPolicyFile("xmlsocket://us-sea-fb6aab57.colyseus.cloud:80")`, trying to explicitly allow the port `443` (I'm not sure this policy file is necessary nowaways as it seems this a legacy behavior from old Flash Player?)

If you can suggest other experiments to do please let us know! Me and @Shaunmax have been pulling our hairs out for a few days :) 

Thank you so much!

**Comment by endel** [comment]
We have not tried creating a policy server at port 843, though! As [this example demonstrates](https://github.com/haxetink/tink_http/blob/master/sample/swf/policy_server.js). Do you think this would help on this issue?

**Comment by ajwfrost** [comment]
Hi @endel, thanks for adding the details here.

If you're running in AIR with the main application SWF file then you shouldn't need a policy server or cross-domain XML file; those are for when the request is coming from a network-domain SWF file (so, if your AIR application loaded a SWF from somewhere else online and ran that in its default security domain, then it may be needed...)

I've just tried with 51.2 using `air.net.WebSocket` (with address `wss://us-sea-fb6aab57.colyseus.cloud`) and it connected okay. Similarly when using a raw `flash.net.SecureSocket` with the address `us-sea-fb6aab57.colyseus.cloud` on port 443. But that's with 51.2; if you're using 51.1 with a recent(ish) Android version, then there is a problem in verifying whether the server certificate is trusted which means all those types of connections end up with an `ioError` - so I suspect that's what you're seeing..

I don't think we have a workaround for this issue that's available within the 51.1 runtime itself; the ANE we created for WebSockets on Android should allow you to use that functionality if required. If you are using your own version of web sockets and need the underlying SecureSocket implementation to work, then we could do a similar ANE, or if you're able to wait a small time to use 51.2, that might be an option? Alternatively we could look at pulling just the Android socket changes into a 51.1.4 variant which would de-risk things (i.e. no big update to 51.2, so that would be a lot quicker too...)

-----

My other concern though is the mention that `URLLoader` may have a problem too? From the `tink` link you shared, this code is using `URLRequest` with `URLLoader` .. so I just tried to load your crossdomain.xml file mentioned earlier, and got this (1138 bytes) successfully via the built-in `URLLoader` implementation on Android (both with 51.2 and with 51.1). So if you are seeing any problems in loading HTTPS content - unless it's using its own HTTP protocol handling - I'd be keen to know more!

thanks

**Comment by Shaunmax** [comment]
> if you're able to wait a small time to use 51.2, that might be an option?

yes, I should be fine with that

**Comment by ajwfrost** [comment]
One issue we're finding with this though... currently trying to check this also on macOS and we're finding an SSL issue. Have you managed to get a websocket connection up an running to the Colyseus server on Mac?

Our logs are showing:
```
< [OPENSSL] objptr Subject: /C=US/O=Let's Encrypt/CN=E6
< [OPENSSL] objptr Issuer: /C=US/O=Internet Security Research Group/CN=ISRG Root X1
< [OPENSSL] OCSP URL is e6.o.lencr.org:80
< [OPENSSL] CreateBIOConnection() for e6.o.lencr.org:80

< [OPENSSL] objptr Subject: /C=US/O=Internet Security Research Group/CN=ISRG Root X1
< [OPENSSL] objptr Issuer: /C=US/O=Internet Security Research Group/CN=ISRG Root X1
< [OPENSSL] Failed to get ocspUrls
< [OPENSSL] CreateBIOConnection() for x1.c.lencr.org:80
< [OPENSSL] Connect took 20 ms
< [OPENSSL] Request: GET / HTTP/1.0
< Host: x1.c.lencr.org
< Connection: close
< [OPENSSL] Read wait...
< [OPENSSL] CRL parsing failed, CRL format DER
```

So it looks like the web server's certificate (from Let's Encrypt) is causing a problem in OpenSSL possibly because of the certificate authority, ISRG, not having OCSP URLs? Or maybe that part wasn't the failure and the problem was with the CRL parsing? Or maybe that's linked...

We can look into this further; it seems to work fine when we're using Java's security/SSL client stuff so should be fixable..

thanks

**Comment by Shaunmax** [comment]
> Have you managed to get a websocket connection up an running to the Colyseus server on Mac?

I just tried and its working fine, is there anything specific you want me to test ?

**Comment by ajwfrost** [comment]
So, the OCSP/CRL stuff was a red herring: it's failing to get anything via either mechanism, but that doesn't actually signify failure, and the `Connection: close` text above is actually just part of the http headers that we're sending to the CRL URL that's shown there.

What was actually happening was an unexpected read response - looks like some SSL handshaking information needed to be processed but AIR was treating that as a 'normal' socket data read, and then getting hung up when we didn't actually receive any client data. Having adjusted this a little, we can now send data (http request for `/`) and get a response (404?) so that part all seems fine.

Which means, the only issue I think that we're left with is the fact that SecureSocket (and therefore WSS web sockets) does not work on Android currently...

**Comment by Shaunmax** [comment]
> SecureSocket (and therefore WSS web sockets) does not work on Android currently...

Before using Colyseus's multiplayer server I was using PlayerIO and I never faced any such issue on Android. I am not sure how PlayerIO is handling it. let me check

**Comment by Stechmuck** [comment]
> or if you're able to wait a small time to use 51.2

@ajwfrost, can you give us an idea of ​​how long it will take until version 51.2 is released?

We'd like to release a new version of our app, and right now it's just stuck on the websocket for Android.

**Comment by ajwfrost** [comment]
Hi

I had been debating here whether we should go for a 51.1.4 variant to include these updates, in case 51.2 is delayed too long. But looking at the stability of 51.2, as long as you don't use the new ANGLE feature (and/or don't try H.264/AAC on Linux) then it appears to be working! We'll try to get a non-prerelease version of 51.2 out at the end of next week, certainly before Easter.

thanks

**Comment by Mintonist** [comment]
@ajwfrost can you create automatization like this: if change notes for AIR SDK release mention github issue  - your script will add comment to the issue like "mention in changelog for 51.xx AIR SDK version with comment: ....".
It will be handy for us, who subscribes for an issue or anyone who searches for help here.

For example this issue has been mention for AIR SDK 51.2.1.1

**Comment by ajwfrost** [comment]
Hi @Mintonist  - I just came across your suggestion, and think it's a great idea! Had a quick look at what it might take to do this, and got a little bogged down in details. So it might be that I just ask one of the team to do this manually..!
But also, to start with it may just be that our release notes (added to the pinned "[announcements](https://github.com/airsdk/Adobe-Runtime-Support/discussions/1699)" discussion) could use links rather than just saying e.g. `Github-3274: Ensuring OSX secure socket is robust for LetsEncrypt`

I might edit that entry actually, to see if it then works and gets a post below here saying this was mentioned .. let me know if you then get a notification about it, assuming you're subscribed to this!

thanks

**Comment by marchbold** [comment]
May I suggest you consider using releases if you are going to setup things a little more official here? 

https://github.com/airsdk/Adobe-Runtime-Support/releases

This allows people to subscribe to them and get notifications etc. Discussions get a bit muddled if you are using them for release announcements that's all :)  

However in the meantime if you just use a `#` in front of a ticket number when posting it to the discussion it will reference the issue. eg #3274: Ensuring OSX secure socket is robust for LetsEncrypt
